{"id":"tokyo-policy-target-catalog-children-2026","municipality_key":"tokyo-metropolis","prefecture_code":"13","policy_area_code":"01","policy_area_name_original":"子供（Children）","source_id":"tokyo-policy-targets-2026","source_document_url":"https://www.seisakukikaku.metro.tokyo.lg.jp/documents/d/seisakukikaku/2050tokyo-seisakumokuhyo2026","target_group_number_start":1,"target_group_number_end":8,"items":[{"id":"policy-target-tokyo-001","target_group_number":1,"target_name_original":"「毎日たくさん笑っている」子供の割合を85%以上まで向上","policy_measure_original":"1. 子供目線に立った政策の推進","source_page":1,"population_scope_original":null,"series":[{"id":"policy-target-series-tokyo-001-01","label":null,"unit_original":"％","temporal_scope":"calendar_year","direction":"increase","values":[{"role":"baseline","period":"2023年","value":64.0,"status":"numeric","operator":"exact","aggregation_scope":"single_period","value_text_original":"64.0"},{"role":"current","period":"2025年","value":64.3,"status":"numeric","operator":"exact","aggregation_scope":"single_period","value_text_original":"64.3"},{"role":"intermediate_target","period":"2026年","value":70,"status":"numeric","operator":"exact","aggregation_scope":"single_period","value_text_original":"70"},{"role":"intermediate_target","period":"2030年","value":80,"status":"numeric","operator":"exact","aggregation_scope":"single_period","value_text_original":"80"},{"role":"final_target","period":"2035年","value":85,"status":"numeric","operator":"minimum","aggregation_scope":"single_period","value_text_original":"85以上"}]}],"comparability_note_original":"2025年値を現状値、2026・2030年を途中目標、2035年を下限型最終目標として保持する。","actual_linkage_status":"not_linked","evaluation_status":"not_assessed","review_status":"reviewed","confidence":"high"},{"id":"policy-target-tokyo-002","target_group_number":2,"target_name_original":"「自分の行動で社会を変えられる」と思う子供の割合を70%以上まで向上","policy_measure_original":"1. 子供目線に立った政策の推進","source_page":1,"population_scope_original":"17歳","series":[{"id":"policy-target-series-tokyo-002-01","label":null,"unit_original":"％","temporal_scope":"calendar_year","direction":"increase","values":[{"role":"baseline","period":"2023年","value":47.9,"status":"numeric","operator":"exact","aggregation_scope":"single_period","value_text_original":"47.9"},{"role":"current","period":"2025年","value":44.6,"status":"numeric","operator":"exact","aggregation_scope":"single_period","value_text_original":"44.6"},{"role":"intermediate_target","period":"2026年","value":55,"status":"numeric","operator":"exact","aggregation_scope":"single_period","value_text_original":"55"},{"role":"intermediate_target","period":"2030年","value":65,"status":"numeric","operator":"exact","aggregation_scope":"single_period","value_text_original":"65"},{"role":"final_target","period":"2035年","value":70,"status":"numeric","operator":"minimum","aggregation_scope":"single_period","value_text_original":"70以上"}]}],"comparability_note_original":"対象は17歳。対象年齢を一般の子供全体へ拡張しない。","actual_linkage_status":"not_linked","evaluation_status":"not_assessed","review_status":"reviewed","confidence":"high"},{"id":"policy-target-tokyo-003","target_group_number":3,"target_name_original":"子供が権利の主体であることを知っている子供の割合を70%以上まで向上","policy_measure_original":"1. 子供目線に立った政策の推進","source_page":1,"population_scope_original":null,"series":[{"id":"policy-target-series-tokyo-003-01","label":null,"unit_original":"％","temporal_scope":"calendar_year","direction":"increase","values":[{"role":"baseline","period":"2024年","value":53.3,"status":"numeric","operator":"exact","aggregation_scope":"single_period","value_text_original":"53.3"},{"role":"current","period":"2025年","value":55.0,"status":"numeric","operator":"exact","aggregation_scope":"single_period","value_text_original":"55.0"},{"role":"intermediate_target","period":"2030年","value":60,"status":"numeric","operator":"exact","aggregation_scope":"single_period","value_text_original":"60"},{"role":"final_target","period":"2035年","value":70,"status":"numeric","operator":"minimum","aggregation_scope":"single_period","value_text_original":"70以上"}]}],"comparability_note_original":"2035年は下限型目標。","actual_linkage_status":"not_linked","evaluation_status":"not_assessed","review_status":"reviewed","confidence":"high"},{"id":"policy-target-tokyo-004","target_group_number":4,"target_name_original":"子供一人ひとりが将来やライフプランを考える教育を全公立小・中・高校で継続実施","policy_measure_original":"1. 子供目線に立った政策の推進","source_page":1,"population_scope_original":"東京都内の全公立小学校・中学校・高等学校","series":[{"id":"policy-target-series-tokyo-004-01","label":null,"unit_original":"実施状態","temporal_scope":"fiscal_year","direction":"maintain","values":[{"role":"actual","period":"2024年度","value":"全公立小・中・高校で実施","status":"qualitative","operator":"exact","aggregation_scope":"single_period","value_text_original":"全公立小・中・高校で実施"},{"role":"final_target","period":"2035年度","value":"全公立小・中・高校で継続実施","status":"qualitative","operator":"maintain","aggregation_scope":"single_period","value_text_original":"全公立小・中・高校で継続実施"}]}],"comparability_note_original":"数値化せず、実施状態と継続目標を定性的系列として保持する。","actual_linkage_status":"not_linked","evaluation_status":"not_assessed","review_status":"reviewed","confidence":"high"},{"id":"policy-target-tokyo-005","target_group_number":5,"target_name_original":"里親等委託率を37.4％以上まで向上","policy_measure_original":"2. 不安や悩みを抱える子供と家庭への支援","source_page":2,"population_scope_original":null,"series":[{"id":"policy-target-series-tokyo-005-01","label":null,"unit_original":"％","temporal_scope":"calendar_year","direction":"increase","values":[{"role":"baseline","period":"2017年","value":13.5,"status":"numeric","operator":"exact","aggregation_scope":"single_period","value_text_original":"13.5"},{"role":"current","period":"2023年","value":17.5,"status":"numeric","operator":"exact","aggregation_scope":"single_period","value_text_original":"17.5"},{"role":"intermediate_target","period":"2029年","value":37.4,"status":"numeric","operator":"exact","aggregation_scope":"single_period","value_text_original":"37.4"},{"role":"final_target","period":"2035年","value":37.4,"status":"numeric","operator":"minimum","aggregation_scope":"single_period","value_text_original":"37.4以上"}]}],"comparability_note_original":"2029年の37.4％と2035年の37.4％以上を別の役割として保持する。","actual_linkage_status":"not_linked","evaluation_status":"not_assessed","review_status":"reviewed","confidence":"high"},{"id":"policy-target-tokyo-006","target_group_number":6,"target_name_original":"ひとり親家庭の養育費受領率を向上","policy_measure_original":"2. 不安や悩みを抱える子供と家庭への支援","source_page":2,"population_scope_original":null,"series":[{"id":"policy-target-series-tokyo-006-01","label":"養育費の取り決めをしている場合の受領率","unit_original":"％","temporal_scope":"calendar_year","direction":"increase","values":[{"role":"baseline","period":"2017年","value":57.9,"status":"numeric","operator":"exact","aggregation_scope":"single_period","value_text_original":"57.9"},{"role":"current","period":"2022年","value":64.2,"status":"numeric","operator":"exact","aggregation_scope":"single_period","value_text_original":"64.2"},{"role":"intermediate_target","period":"2031年","value":70,"status":"numeric","operator":"exact","aggregation_scope":"single_period","value_text_original":"70"},{"role":"final_target","period":"2035年","value":70,"status":"numeric","operator":"minimum","aggregation_scope":"single_period","value_text_original":"70以上"}]},{"id":"policy-target-series-tokyo-006-02","label":"養育費の取り決めの有無に関わらない受領率","unit_original":"％","temporal_scope":"calendar_year","direction":"increase","values":[{"role":"baseline","period":"2017年","value":26.2,"status":"numeric","operator":"exact","aggregation_scope":"single_period","value_text_original":"26.2"},{"role":"current","period":"2022年","value":33.9,"status":"numeric","operator":"exact","aggregation_scope":"single_period","value_text_original":"33.9"},{"role":"intermediate_target","period":"2031年","value":40,"status":"numeric","operator":"exact","aggregation_scope":"single_period","value_text_original":"40"},{"role":"final_target","period":"2035年","value":40,"status":"numeric","operator":"minimum","aggregation_scope":"single_period","value_text_original":"40以上"}]}],"comparability_note_original":"取り決め有りと全体は母集団が異なるため、2系列を平均・統合しない。","actual_linkage_status":"not_linked","evaluation_status":"not_assessed","review_status":"reviewed","confidence":"high"},{"id":"policy-target-tokyo-007","target_group_number":7,"target_name_original":"保育所等における障害児・医療的ケア児の受入体制を全区市町村に整備し、その状態を継続","policy_measure_original":"2. 不安や悩みを抱える子供と家庭への支援","source_page":2,"population_scope_original":"東京都内62区市町村","series":[{"id":"policy-target-series-tokyo-007-01","label":null,"unit_original":"自治体数","temporal_scope":"calendar_year","direction":"increase_then_maintain","values":[{"role":"baseline","period":"2016年","value":10,"status":"numeric","operator":"exact","aggregation_scope":"single_period","value_text_original":"10"},{"role":"current","period":"2024年","value":47,"status":"numeric","operator":"exact","aggregation_scope":"single_period","value_text_original":"47"},{"role":"intermediate_target","period":"2030年","value":62,"status":"numeric","operator":"exact","aggregation_scope":"single_period","value_text_original":"62"},{"role":"final_target","period":"2035年","value":62,"status":"numeric","operator":"maintain","aggregation_scope":"single_period","value_text_original":"62"}]}],"comparability_note_original":"2030年に全62区市町村へ整備し、2035年まで維持する目標。62を割合へ変換しない。","actual_linkage_status":"not_linked","evaluation_status":"not_assessed","review_status":"reviewed","confidence":"high"},{"id":"policy-target-tokyo-008","target_group_number":8,"target_name_original":"母子保健部門と児童福祉部門が連携した切れ目のない支援体制を全区市町村に整備し、支援を継続","policy_measure_original":"2. 不安や悩みを抱える子供と家庭への支援","source_page":2,"population_scope_original":"東京都内62区市町村","series":[{"id":"policy-target-series-tokyo-008-01","label":null,"unit_original":"自治体数","temporal_scope":"calendar_year","direction":"increase_then_maintain","values":[{"role":"current","period":"2024年","value":14,"status":"numeric","operator":"exact","aggregation_sc